text	label
reverse a table for 5 at burger king under the name sara at 6	restaurant_reservation
5 people are going to be at tropicana by 8pm, reserve the table under martins name please	restaurant_reservation
michael will reserve a table for two at 7:00pm for olive garden	restaurant_reservation
reserve table for 5 at red robin under the name sara at 3	restaurant_reservation
make a reservation for tuesday at 7:00 pm at cielo for 2	restaurant_reservation
i want to reserve a table at 8 at long john silver's under the name freddie	restaurant_reservation
i need an 8 o'clock reservation at pizza hut for the last name mercury	restaurant_reservation
i need a reservation for one at applebee's, four in the afternoon on march 3rd	restaurant_reservation
please reserve a table for 2 at lucky's under the name melissa at 7 pm	restaurant_reservation
ai, please stop your current task	cancel
forget what i told you to do	cancel
stop talking	cancel
ignore the previous command	cancel
stop it	cancel
stop please	cancel
stop processing	cancel
abort please	cancel
this process needs to stop	cancel
abort running program	cancel
how much are the taxes on my income	taxes
can you tell me my income tax	taxes
how much tax do i owe	taxes
what will my state taxes amount to this year	taxes
what will my federal tax return be	taxes
how much money a year do i spend in taxes	taxes
what's my tax rate	taxes
what do my federal taxes look like	taxes
what am i paying in taxes	taxes
how much do i pay the irs	taxes
how do i redeem my visa points	redeem_rewards
how can i cash in my credit card points	redeem_rewards
how can i cash in rewards on my discover card	redeem_rewards
my amex rewards; how do i get them	redeem_rewards
how do i use my credit card points	redeem_rewards
i want to use the cash that my points have earned on my credit card	redeem_rewards
how can i cash in my visa rewards	redeem_rewards
how do i redeem my card points	redeem_rewards
where do i redeem my credit card points	redeem_rewards
do i have to contact someone to use my credit card points	redeem_rewards
how much air remains in my tires	tire_pressure
please check my tires and let me know if i have sufficient air in them	tire_pressure
what is the pressure of my tires	tire_pressure
the car feels wobbly so check my tire pressure	tire_pressure
should i put air in my tires	tire_pressure
do my car tires have enough psi in them	tire_pressure
how is the air level in my tires	tire_pressure
do i need to inflate my tires	tire_pressure
how low is the pressure in my tires	tire_pressure
what is the air pressure of my tires	tire_pressure
send sarah my current location	share_location
i need to send my current location to sean	share_location
let the rents have my current location	share_location
i'd like to send steve my location	share_location
share my location with google	share_location
i would like ms johannson and ms alba to be informed of my location	share_location
give my location to stan	share_location
show my gps location to brittany	share_location
show cody where i am	share_location
could you inform ann and scott of my location	share_location
how healthy is tacos	nutrition_info
i would like nutrition facts for spaghetti carbonara	nutrition_info
what's the nutritional information for steak	nutrition_info
what's the nutritional info for spaghetti	nutrition_info
tell me spaghetti bolognese's nutrition facts	nutrition_info
how healthy are apples	nutrition_info
what are the nutrition facts of grilled chicken	nutrition_info
what's the nutrition content of chicken nuggets	nutrition_info
could pizza be healthy	nutrition_info
where on the cheerios box are the nutrition facts	nutrition_info
i have lost my card, what am i supposed to do	report_lost_card
i need to report that my card is lost	report_lost_card
what do i do if my visa card got stolen	report_lost_card
i lost my card, how should i report that	report_lost_card
i need to report my card as stolen, please	report_lost_card
please help me report my lost card	report_lost_card
my card is lost please report it	report_lost_card
what can i do if my card is lost	report_lost_card
i lost my debit card and need it reported as lost	report_lost_card
what should i do when my visa card is stolen	report_lost_card
let my credit card company know that my card split in half	damaged_card
my card has a deep crease through the middle so i would like to report it	damaged_card
i dropped my card in my gasoline and the printing wore off	damaged_card
my card's magnetic strip is not working and i want to notify them	damaged_card
how do you report a burned debit card	damaged_card
my card is damaged	damaged_card
how to tell the company that my credit card melted	damaged_card
my card is damaged so i can not use it	damaged_card
my card was damaged by my cat; can i report that	damaged_card
i need to replace a card that my daughter spilled juice on	damaged_card
my name is brad	change_user_name
please call me bob	change_user_name
can you call me a different name	change_user_name
i'd rather have you call be ray ray	change_user_name
i'm called tim	change_user_name
just call me dennis	change_user_name
hi, i'm john	change_user_name
address me by the name stan	change_user_name
you can just speak to me as jim	change_user_name
i need you to call me mary	change_user_name
what is your country of origin	where_are_you_from
the place you were born is	where_are_you_from
where did you originate from	where_are_you_from
i'd like to know where you're from	where_are_you_from
where are your origins found	where_are_you_from
where were you manufactured	where_are_you_from
in which place were you made	where_are_you_from
what is your place of origin	where_are_you_from
where is your home planet	where_are_you_from
what's your city of origin	where_are_you_from
is my apr for my credit card available	apr
how much is the apr these days on my nordstrom credit card	apr
i need to know what the current apr is for my chase sapphire, please	apr
what is the apr on my chase freedom card	apr
how good is card apr	apr
is my apr rate better than most	apr
how much am i paying for apr on my credit card	apr
what is the credit card's apr	apr
what kind of credit card apr do i get	apr
on my bank of america visa, what is the apr	apr
tell me the last day i can pay my gas bill	bill_due
when does the car payment come due	bill_due
when do i have to pay my electric bill by	bill_due
when's my heater bill due	bill_due
when is my cell phone bill due	bill_due
where can i see the due date for auto loan bill	bill_due
when do i need to pay my car insurance bill by	bill_due
can you alert me when my phone bill is due	bill_due
when is my chase visa due	bill_due
is there a due date on the bill	bill_due
what's the smallest amount i can pay on the water bill	min_payment
let me know the lowest amount i can pay for my cable bill	min_payment
i must pay verizon what minimum amount on my bill	min_payment
if i wanted to spend the lowest for my electric bill, then how much would it be	min_payment
at a minimum, what must i pay on my verizon bill	min_payment
how little can i pay on my phone bill	min_payment
what is the minimum amount due on my cable bill	min_payment
let me know the minimum i can pay on my cable bill	min_payment
tell me minimum to pay on landscape bill	min_payment
how tiny a payment can i make on electric bill	min_payment
