text	label
will i need a visa to go to moldova	international_visa
visa's are hard to get do i need one when i travel to israel	international_visa
to vacation to tel aviv do i need a travel visa	international_visa
i need to know if i must have an international visa to go to france	international_visa
does mexico require an international visa	international_visa
if i go to brazil, do i need to get an international visa	international_visa
i need to know if i need a visa to travel to el salvador	international_visa
does laos require a travel visa	international_visa
will i need a visa to visit ireland	international_visa
does mexico travel require a visa	international_visa
has there been any changes in the status of my credit card application	application_status
when will my credit card app be approved	application_status
i want to know if my application for a credit card at community bank has been approved or not	application_status
has my application for a trust bank credit card been mailed out and if so was i approved or not	application_status
did they process the credit card i applied for	application_status
can you check if my mastercard application has been reviewed yet	application_status
where can i find out the status of my credit card application	application_status
when can i hear the decision on my credit card application	application_status
what is the status of my new credit card application	application_status
i want to know the status of my credit card application	application_status
how long should i fry an egg for	cook_time
how long do i need to cook pot au feu for	cook_time
about how long should you cook lasagna	cook_time
how long does it take to prepare a lasagna	cook_time
how long do i cook chicken breast	cook_time
how long does it take to make pho	cook_time
when can i expect meal of salmon to be finished	cook_time
how long do i cook steak	cook_time
how long do the brownies have to cook	cook_time
how long do i boil eggs	cook_time
what is my annual percentage rate	interest_rate
i need help finding the apr on my aspire loan	interest_rate
what kind of interest can i expect with my chase account	interest_rate
i want to know my interest rate	interest_rate
what is walker bank paying me in interest on my account	interest_rate
what interest rate am i getting from citigroup	interest_rate
help me determine my interest rate	interest_rate
i must find the interest rate for my checking account	interest_rate
where do i see what interest my mortgage has	interest_rate
i would like to know my chase interest rate	interest_rate
please put babysitting on my to do list	todo_list_update
i just finished taking out my recycling, so cross that off my to do list	todo_list_update
clear my to do list	todo_list_update
cross off grocery shopping from todo list	todo_list_update
remove grocery shopping from todo list	todo_list_update
put clean refrigerator on my spring cleaning to do list	todo_list_update
erase get a haircut from my to do list, please	todo_list_update
help remind me that i need to add laundry to my list of housework	todo_list_update
throw mopping onto my to do list	todo_list_update
please cross off schedule acupuncture appointment off of the to do list	todo_list_update
i'd like to add pancake mix to my shopping list if it's not already there	shopping_list_update
i'm out of bananas; add to shopping list	shopping_list_update
on my shopping list, remove eggs	shopping_list_update
add eggs to my shopping list if it's not already there	shopping_list_update
is milk in my shopping list if not, add it	shopping_list_update
i would like to put carrots on my list for shopping	shopping_list_update
milk should be added to my shopping list	shopping_list_update
we no longer need fries on the shopping lisr	shopping_list_update
add sprite to my shopping list	shopping_list_update
do i have milk on my shopping list please add it if it is not	shopping_list_update
what timezone is phoenix in	timezone
what's the timezone over there	timezone
i need the time zone for la	timezone
whats the timezone for modesto	timezone
what timezone is melbourne in	timezone
which timezone is england in	timezone
what are the time zones of russia	timezone
what is texas's timezone	timezone
for italy what timezone is it in	timezone
what timezone do they use in arizona	timezone
would you mind switching to whisper mode	whisper_mode
turn off whisper mode	whisper_mode
enable whisper mode	whisper_mode
leave whisper mode	whisper_mode
i want you to use whisper voice now	whisper_mode
volume to whisper voice	whisper_mode
please shut off whisper mode for now	whisper_mode
go to the whisper voice	whisper_mode
can you whisper until i tell you not to	whisper_mode
change mode to whisper	whisper_mode
how many calories are in oranges	calories
how many calories are in a bag of regular doritos	calories
rolls have how many calories	calories
how many calories should i plan to be in a donut	calories
can you tell me the amount of calories i can expect one tuna sandwich to contain	calories
can you tell me the calorie count in a glazed donut	calories
what is the calorie content of a scoop of chocolate ice cream	calories
inform me of the calorie content of vanilla ice cream	calories
how many calories on average are in a hot dog	calories
can you tell me the calories for the cheeseburger	calories
do i have brush my teeth on my todo list	todo_list
the tasks for today, what are they	todo_list
what's on my todo list	todo_list
did i put unpacking groceries on my to do list	todo_list
tell me what things i need to accomplish per my to do list, please	todo_list
is cleaning the outside windows on my todo list	todo_list
what items do i need to do	todo_list
tell me the content of my to do list today	todo_list
what is left to do today	todo_list
does my errand list have goodwill on it	todo_list
is my day off request approved	pto_request_status
i want to know the status of my vacation request	pto_request_status
has my vacation request been updated	pto_request_status
my vacation, has it been approved yet	pto_request_status
how is my vacation looking	pto_request_status
has my vacation request been approved yet	pto_request_status
check if my vacation time has been approved	pto_request_status
do you know if my vacation request has been approved	pto_request_status
did you get confirmation my vacation is a go	pto_request_status
please let me know the status of my vacation request	pto_request_status
roll the five sided die	roll_dice
complete a roll on a 4 sided dice	roll_dice
please roll the 5 sided dice	roll_dice
i need a 10 sided die rolled	roll_dice
can you roll a dice with 6 sides	roll_dice
role a 10 sided die for me	roll_dice
give a 6 sided dice a roll for me	roll_dice
will you roll a 2 sided dice	roll_dice
roll a die please	roll_dice
i want you to roll a 5 sided dice for me	roll_dice
i wanna know when should i get my tires changed next	tire_change
would you say i need new tires if i last bought them on the 24th	tire_change
how many miles are my tires rated for	tire_change
how often do tires need changing	tire_change
how many miles do i drive before i have to get new tires i replaced them four years ago	tire_change
would you tell me when i should replace my tires next if i last replaced them on june 2	tire_change
how do i know if it is time to replace my tires	tire_change
when do my tires need changing after i replaced them last week	tire_change
how often should i get my tires changed	tire_change
when should i replace my tires next if i last replaced them on the 1st	tire_change
when can i start boarding my flight	flight_status
tell me the status of flight dl123	flight_status
i need to know when my flight scheduled to board	flight_status
what's the status of by delta flight	flight_status
are there any expected delays for flight dl123	flight_status
how long until my flight is here	flight_status
what landing time is scheduled for my flight	flight_status
when will i get to my destination	flight_status
what's the news with my delta flight	flight_status
i would appreciate it if you could tell me the status of my southwest flight	flight_status
let's add wonder by hillsong united to my playlist	update_playlist
please add this song to my country music playlist	update_playlist
add a song to my rock playlist	update_playlist
add this song to my jazz playlist	update_playlist
"""i want this song put on my """"kids"""" playlist"""	update_playlist
"""make this song part of the """"kids"""" playlist"""	update_playlist
add single ladies by beyonce to my pop playlist	update_playlist
please add what i listen to to my lolla playlist	update_playlist
can you help me add the song i listen to to my clutch playlist	update_playlist
i gotta add hey jude by the beatles to my playlist	update_playlist
can i increase my credit limit from 1000 to 2000 please	credit_limit_change
can i raise the credit limit for my discover card	credit_limit_change
can i increase the credit limit on my walmart card	credit_limit_change
change my credit limit, please	credit_limit_change
is there a way to increase the limit on my visa card	credit_limit_change
can i increase the credit limit on my capital one card	credit_limit_change
i need to increase my credit limit for my visa credit card, can you assist me	credit_limit_change
please help me increase my mastercard credit card limit	credit_limit_change
can i increase the credit limit on my discover card	credit_limit_change
is it possible to increase my credit limit to 1000 dollars	credit_limit_change
i need you to flip a coin once	flip_coin
flip a coin, i choose heads	flip_coin
ai, flip a coin for me	flip_coin
lets go with heads or tails	flip_coin
flip a coin heads or tails	flip_coin
lets do a coin toss, i call tails	flip_coin
flip a coin now	flip_coin
heads, coin flip	flip_coin
will you get a coin and flip it	flip_coin
i call tails for a coin flip you need to do right now	flip_coin
i want a hotel with good review in honolulu, can you find one	book_hotel
can you book me a hotel in los angeles near commerce casino from april 1st to the 5th	book_hotel
i'd like a placed booked in san diego from may 1st, 2020 to june 2nd, 2020	book_hotel
i need a hotel room for 4 people in lakewood from monday to wednesday	book_hotel
are there any openings in new york city from april 2 through april 8	book_hotel
i need a bed in brownsburg near walmart from apil 4th until the 5th	book_hotel
book me a hotel room in memphis for 3 people from 3/6 until 3/10	book_hotel
i need to book a hotel in ny, queens arrive on 8th and leave on the 13th	book_hotel
get me a hotel room big enough for 4 people from may 3 to may 5 in boston	book_hotel
i need your help to find a good reviewed hotel in washington	book_hotel
when will i need my next oil change	oil_change_when
when will i need to change my oil again	oil_change_when
after how long should i change my oil	oil_change_when
when does my oil need to be changed	oil_change_when
should i get an oil change	oil_change_when
when will my car need an oil change	oil_change_when
how often should i change the oil	oil_change_when
how long until i need to change my oil	oil_change_when
what is the time frame for changing oil	oil_change_when
how do i know when i need my next oil change	oil_change_when
what are your favorite hobbies to take part in	what_are_your_hobbies
what are some things you like doing	what_are_your_hobbies
i want to talk to you about your hobbies	what_are_your_hobbies
what do you do on off days	what_are_your_hobbies
what things do you like to do	what_are_your_hobbies
what are some of your hobbies	what_are_your_hobbies
tell me about your hobbies	what_are_your_hobbies
what are some of the hobbies you enjoy doing	what_are_your_hobbies
what kinds of activities to you participate in during your free time	what_are_your_hobbies
are you involved in hobbies	what_are_your_hobbies
please cancel the table for two at burger king	cancel_reservation
tell the restaurant to cancel my reservation	cancel_reservation
repeal the dinner reservation	cancel_reservation
could you cancel my reservation for winters at the palace tonight	cancel_reservation
is it possible to cancel the reservation at outback for the johnsons	cancel_reservation
please cancel my 7:30 reservation for morton's	cancel_reservation
cancel that reservation for 8 at barney's	cancel_reservation
please cancel the table i had reserved for tonight	cancel_reservation
cancel reservation at eight for the group	cancel_reservation
i need to put in a cancellation for the dinner plans tonight	cancel_reservation
i need to know the date in 256 days	date
when will it be in 10 days	date
give me today's date	date
give me tomorrow's date please	date
please give me today's date	date
what will the date be 100 days from now	date
what date will it be 9 days from now	date
tell me what the date will be tomorrow	date
give me the date	date
in 2 days, what date will it be	date
do i have reservations at creme at 7 pm	confirm_reservation
i would like to try and confirm that i have a reservation at macaroni grill for silva	confirm_reservation
you know the reservation i have on 2:00 friday i confirm it	confirm_reservation
verify my reservation for smith and wollensky at 6:45	confirm_reservation
i would like to try and confirm that i have a reservation at chili’s for melinda	confirm_reservation
can you you confirm my reservation for jean at taco house	confirm_reservation
check to see if i have reservations at prado at 6 pm	confirm_reservation
can you confirm my reservation for steve at olive garden	confirm_reservation
please tell me if my reservation is scheduled for sally's at 3 pm	confirm_reservation
please confirm my reservation for dinner at gusto handcrafted pasta & pizza at 6:30 pm	confirm_reservation
what's the amount due on my vet and vehicle registration bills	bill_balance
what do i owe to jcp	bill_balance
how much is my comcast bill	bill_balance
find out what my water bill costs please	bill_balance
can you check and see how much i owe on my cable bill	bill_balance
how much is my water bill for	bill_balance
what do i owe this month on all my bills	bill_balance
how much is my cable bill for	bill_balance
how much is the car bill this month	bill_balance
do you know how much i owe on my cable bill	bill_balance
please increase your speaker volume	change_volume
turn up your volume	change_volume
please adjust your settings	change_volume
bring the sound up	change_volume
louder please	change_volume
i want that volume bumped up to 4	change_volume
turn it up please	change_volume
i want your volume decreased please	change_volume
i would like the volume lower	change_volume
go ahead and increase your speaker volume	change_volume
find instructions for how to change the oil in a 2015 passat	oil_change_how
i should use what kind of oil and can you help me change it	oil_change_how
teach me how to change the oil in my vehicle	oil_change_how
is it easy to change the oil in my car	oil_change_how
can you tell me how to change the oil in my car	oil_change_how
can you tell me how to change my car's oil, and what type i need to buy	oil_change_how
steps to change car oil	oil_change_how
how will i change my car's oil	oil_change_how
how do i change my oil with the correct type	oil_change_how
can you teach me how to change my oil in my car	oil_change_how
thanks for that!	thank_you
you are so nice to think of me	thank_you
i can not thank you enough	thank_you
thanks a lot for the answer	thank_you
that's all i need, thanks!	thank_you
thanks so much ai	thank_you
many thanks	thank_you
thanks for helping out	thank_you
that answer was very helpful, thanks	thank_you
thank ya!	thank_you
how many days until my amex card reaches it expiration date	expiration_date
does my card have an expiration date and if so, what is it	expiration_date
my card expires in what month	expiration_date
i need to know when my card is set to expire please	expiration_date
what is the expiration date on my credit card	expiration_date
what date will my hy-vee card need to be renewed	expiration_date
what is the expiration date on my visa card	expiration_date
do you know the expiration date that is on my visa card	expiration_date
my american express card expires on what date	expiration_date
what is the expiration month and year on my credit car	expiration_date
please put a block on my us bank account immediately	freeze_account
i need you to act swiftly and freeze all activity on my capital one checking	freeze_account
would you please put a block on my chase account right away	freeze_account
i want a block placed on my checking account right away	freeze_account
place a stop on my bank account	freeze_account
please make my account a frozen one	freeze_account
can you freeze my account, please	freeze_account
please pause my banking actions	freeze_account
are you able to put a stop on my bank account	freeze_account
put a hold on my bank account please	freeze_account
look up the song that's on right now	what_song
what track am i listening to	what_song
tell me the song that is currently playing	what_song
what's the title of this track	what_song
what song am i hearing	what_song
i want to know the name of the song that's playing	what_song
what music is playing on the the bluetooth now	what_song
what is the title of this track	what_song
whats this song	what_song
do you know the song on the speaker right now	what_song
can you book a car rental today to new york city to philadelphia	car_rental
are you able to help with booking a car rental in seattle	car_rental
i will be in boston from march 2 to march 4 can i rent a car for that time	car_rental
can i rent a sports car in augusta for 3/4 through 3/8	car_rental
is it possible to get a ford in austin from may the 5th to may the 7th of this year	car_rental
could i get assistance booking a car rental in las vegas	car_rental
show me how to rent a car in las vegas	car_rental
id like a car rental between january 1st to the 3rd in denver, id like a ford	car_rental
find me a rental car from 2/28 - 3/1 in reno	car_rental
will you please assist me with renting a car in boise	car_rental
i must pay my cable bill from my checking account	pay_bill
pay my gas bill with my checking account	pay_bill
i want to pay my electric bill	pay_bill
can you help me pay my phone bill	pay_bill
i need help paying my auto insurance bill	pay_bill
i'd really like to pay this bill	pay_bill
pull up my electric bill, i want to pay it	pay_bill
help me get my gas bill paid	pay_bill
pay my water bill from my chase account please	pay_bill
schedule a gas bill payment	pay_bill
will i have enough to get a new roku with my savings account	balance
what is my savings balance	balance
what is the total of my bank accounts	balance
what is the available balance in savings	balance
how much do i have in my bank accounts	balance
what's the balance on my bank account	balance
is tehre enough in my bluebird account for groceries this week	balance
how much money do i have in all of my accounts	balance
how much is in savings	balance
can you tell me my checking account balance	balance
tell me when was car in shop	last_maintenance
tell me the date of my last car check up	last_maintenance
dates for my car in the shop	last_maintenance
when was my car last in the shop	last_maintenance
when did i take my car to the shop last	last_maintenance
tell me the last time i had my car checked out at sam's repair shop	last_maintenance
when was my car last worked on	last_maintenance
when did last go to the auto repair shop	last_maintenance
i need to know when it was that i last took my car to have the oil changed	last_maintenance
what day did i last have a technician check out my vehicle	last_maintenance
what did i ask you to remind me of	reminder
check to see if picking up glenn from the airport is on my list of reminders	reminder
is grocery shopping on my reminders list	reminder
i need to know the content of my list of reminders	reminder
tell me everything i included on my list of things to remember for later	reminder
refresh my memory about what items i want to remember	reminder
can you read my reminder list, please	reminder
is the company party on my list of reminders	reminder
what were those things i wanted to remember	reminder
tell me what i had wanted to remember earlier	reminder
what's next on the list	next_song
jump to the next song on this playlist	next_song
remember to play the next number on this particular playlist	next_song
skip this song, please	next_song
skip and next	next_song
what is the next song to be played	next_song
maybe we can go to the next song	next_song
lets pause this song and move onto the next	next_song
play the next musical number	next_song
go forward to the next track	next_song
what meetings do i have today from 3 to 4	meeting_schedule
which meetings do i have today	meeting_schedule
when is my meeting with infrastructure	meeting_schedule
are there any meetings on my calendar today	meeting_schedule
is the meeting with lisa today	meeting_schedule
when is my meeting with ann	meeting_schedule
when is that meeting with kara	meeting_schedule
what are my meetings today	meeting_schedule
do i have any meetings with mark today	meeting_schedule
tell me when today's meeting is supposed to happen	meeting_schedule
why did macy's decline my card	card_declined
what is the reason for whole foods declining my card	card_declined
what was the problem with my card yesterday	card_declined
why did my card get rejected yesterday	card_declined
why can't i use my credit card	card_declined
why won't you let me pay with my credit card	card_declined
why was my card got declined when i am trying to pay for dinner when i am in vietnam	card_declined
i went to target to buy a mug but my card did not work	card_declined
how come i got declined	card_declined
for which reason was my card declined yesterday	card_declined
what do you know me as	user_name
what is the name you would use for me	user_name
i need to know the name that you have for me	user_name
do you think my name is jeff	user_name
what do you know me by	user_name
tell me my name the way its saved	user_name
what am i called by you	user_name
what is my name	user_name
what do you think you will refer to me as	user_name
by what name do you refer to me	user_name
what's your age alexa	how_old_are_you
how old is al	how_old_are_you
what's your age right now	how_old_are_you
how old	how_old_are_you
your birthday please	how_old_are_you
what you age on your last birthday	how_old_are_you
how old are you as of today	how_old_are_you
hey how old are you	how_old_are_you
how many years are you	how_old_are_you
tell me when you were born	how_old_are_you
i want to hear something funny	tell_joke
what sort of jokes do you know	tell_joke
tell me something funny about americans	tell_joke
know any jokes	tell_joke
do you know any jokes	tell_joke
i need to know somthing funny	tell_joke
tell me a joke about baseball	tell_joke
tell me something funny about politics	tell_joke
i want to hear something hilarious	tell_joke
tell me something amusing	tell_joke
give me the routing number for my paragon account	routing
i need to know my routing number	routing
where do i find the routing number for navy federal	routing
i need the routing number to my chase checking account	routing
ai, what is my chase routing number	routing
i need to know the routing number for my checking	routing
tell me the routing number for my wf account	routing
what's bank of america's routing number	routing
what's the routing number for my money market account	routing
i need to find the correct td bank routing number for my pennsylvania account	routing
do you know how to say where is the restroom in french	translate
please tell me how to ask for a taxi in french	translate
in spanish, meet me tomorrow is said how	translate
what do spanish people say for the word cow	translate
translate hello into french for me	translate
translate for me hello into french	translate
how do i say bathroom in italian	translate
can you tell me how to say 'i do not speak much spanish', in spanish	translate
how do vietnameses people say hello	translate
how do i say you're welcome in chinese	translate
can you talk to me in french	change_language
speak in french please	change_language
can you translate that to french	change_language
change response language from mandarin to english	change_language
speak french	change_language
please let's speak in spanish	change_language
can you speak to me using japanese	change_language
please change your language setting to spanish now	change_language
can i speak spanish to you hombre	change_language
can you speak to me in chinese	change_language
i am in need of my w2 for tax reasons; provide me where to get it	w2
where can i get my w-2	w2
tell me where to a w2 form	w2
from where are w2 forms given	w2
where do i pick up a w2 form	w2
where do i get the form that shows my wages for the year for taxes	w2
i've got tax issues and need help obtaining my w2	w2
please tell me where to get the w2	w2
where can i get a w2 form	w2
have i been sent my w-2 in my email	w2
what's the weather like today	weather
what is the high temperature for tomorrow	weather
how much snow will we be getting tomorrow	weather
what is the weather outside	weather
what's is the current weather forecast	weather
what does the weather look like	weather
whats the forecast for the weather	weather
weather in costa mesa	weather
how is that weather	weather
what's the highest chance of rain for today	weather
reserve a table for 3 at outback steakhouse under the name lance at 7:00pm	restaurant_reservation
